text	user_id	news_id	cluster
BOOM	823528762117537792	politifact15401	1
It'd BE BEST if he weren't there	34106968	politifact15401	1
See Donna you can be nice	98787272	politifact15401	1
Ohhhh, good one LOLOL	3311799854	politifact15401	1
 yeah sure	785289018757873664	politifact15401	1
All the best to her for a speedy recovery.	4079118263	politifact15401	1
Sick	756510757831970816	politifact15401	1
under his eye	618192880	politifact15401	1
Sorry for the grammatical error I was under the impression people made them on Twitter	760114803033509889	politifact15401	1
#Processing	936878499532488704	politifact15401	1
for Our Beautiful FLOTUS!	991753896484786176	politifact15401	1
Prayers	889539974231715842	politifact15401	1
That's a long time	2317372791	politifact15401	1
I was thinking the exact same thing.	1228127138	politifact15401	1
Of course!	874714596	politifact14749	1
Shut up! She had some plastic surgery to add to her collection	32754729	politifact15401	1
FOLLOW HER MONEY	19937107	politifact14749	1
I know!!!! 	767783347124711424	politifact15401	1
The wall is there to cover up the pedi ring	274074181	politifact15512	1
God bless	820321037984350208	politifact15401	1
Standing next to the orange Pustule is pure toxic poisoning 	265665561	politifact15401	1
uh oh, someone's triggered 	2334282788	politifact15401	1
Prayers	865022359899709441	politifact15401	1
I hope all goes well for her	116225829	politifact15401	1
Sick	756510757831970816	politifact15401	1
Praying for our #FLOTUS!	741334289376116736	politifact15401	1
Sick burn	958172393914040322	politifact15401	1
Or she told him to keep his sorry ass away!! 	790626212183994368	politifact15401	1
God bless her	2611786073	politifact15401	1
Prayers for Melania 	3246885733	politifact15401	1
Not surprised	38700230	politifact15401	1
#prayforflotus	389831604	politifact15401	1
Prayers	297707887	politifact15401	1
Surprised Not!	4840937793	politifact14749	1
He caused her that	3438067744	politifact15401	1
Baron is a forgotten soul!	803810059490709504	politifact15401	1
Prayers	420026228	politifact15401	1
Probably just wanted to get a break from fathead 	783469490	politifact15401	1
Wow	832807736207409152	politifact15401	1
I hope she gets best soon!	803658334737932290	politifact15401	1
Pathetic	756510757831970816	politifact15401	1
It's an emergency surgery fuck head	961748472948019200	politifact15401	1
Me too	3219814748	politifact15401	1
Will be in my prayers	4591212675	politifact15401	1
You can't compare an angel to the devil .	1339854948	politifact15401	2
If she had the procedure they announced, kidney embolization, it is not actually categorized as a surgery and is more often than not done on an outpatient basis unless there are complications. Most patients go home same day or day after.	874827085285642240	politifact15401	2
And This???	2585366864	politifact15401	2
She is the first US first lady to undergo such a serious medical procedure while in the White House since Nancy Reagan had a mastectomy in October 1987. Rosalynn Carter underwent surgery to remove a benign lump from her breast in April 1977.	822791641396289536	politifact15401	2
Be Best	40444923	politifact15401	2
Facts Brandy, Obama is not a terrorist.  Try looking up the amount of $$ spent on the Trumps vacations, travel, golf.  They are charging the American people for it all, the amount will surpass in 4 years what was spent on Obama in 8.	785289018757873664	politifact15401	2
Must Be Nice To Have Health Care That's Paid For!	815871284	politifact15401	2
Derp.	737474932607614977	politifact14991	2
I understand Agolf Twitler let her out to donate a kidney to replace the one that failed because of his dependency on Propecia.	983150033368375296	politifact15401	2
Me too. She is fine. Trump is the a hole	785609157021872129	politifact15401	2
Helloooooo	48664161	politifact15401	2
Yeah let's shove the most heavily secured family in the world into a car and bring them to a hospital to disrupt the entire building where people's lives are on the line. You can't just bring the president places, you have to prepare the location and bring the motorcade	826716752314785792	politifact15401	2
Lock her up	905869350279766018	politifact14749	2
Interventional Radiologist here, Melania Trump most likely had embolization of an AML (angiomyolipoma) which is prone to bleeding if it gets large enough.  Fibroids are in the uterus almost exclusively and cysts would not be embolized.	24073763	politifact15401	2
Let's guess if he's giving up his private armed security.	745371052230877184	politifact15512	2
Get well beautiful	2317606894	politifact15401	2
"But he went after ""work""..... I would never let my husband have surgery while I was at work then go see him later. Most people who love their spouse wouldn't either. If you can golf every weekend then you can take a few hours out to sit bed side."	1140728275	politifact15401	2
She's no longer without scaring, time for a new mail order porn star.	16744359	politifact15401	2
... and treatment at Walter Reed was for battered wife syndrome, o' no, a kidney problem	832320152616235009	politifact15401	2
Mind your own business troll	18852713	politifact15401	2
Thoughts and prayers. Wish you were married to someone else so their would be joy, happiness and peace in ur life.	249843693	politifact15401	2
I hope she gets better quickly, but if it was anyone else they would get 23 hrs. in the hospital and the boot.	3152983690	politifact15401	2
"Good point.
She would appreciate his absence while recuperating."	26028634	politifact15401	2
!	994223976707747840	politifact15401	2
being there for his wife maybe ? i dont know just a thought. #commondecency	971821103860600832	politifact15401	2
Kind comment - thank you	4838572798	politifact15401	2
She's the 1st lady, she deserves the best. Anyways they could pay for it out of pocket if they wanted.	747997444080689152	politifact15401	2
WITCH!	984698448745136131	politifact15401	2
He just continues to suck in every way.	2165755296	politifact15401	2
Melania deserves kindness, respect and well wishes. So many cruel comments. How many of you have divorced a spouse because you're acting like she's a disliked X. We need more love to stop the hatred and wars and upheaval. Can we be kinder? #love begets love Create a loving life	477474628	politifact15401	2
"""you people""?"	1323401149	politifact15401	2
Ahhh hell, get me off this planet please!	1078088604	politifact14270	2
I feel the same way her husband has taken our health care and see gets for free.	908879246277382144	politifact15401	2
Suctioning a bit of cosmetically unappealing fat from around the kidney zone..	27583082	politifact15401	2
Sending Prayers	866387850710876160	politifact15401	2
That's okay. I bet her Tiffany's security guard boyfriend was there.	786921500142145537	politifact15401	2
Your man stressing you out?	38204386	politifact15401	2
"I'm no Melania fan, not by a long shot, but it pisses me off that The Great Orange Menace doesn't make ANY effort..kidney surgery is no joke, would have cost him nothing to be a teensy bit kind
Gonna console myself w/the thought she told him to fck off, she didn't want him there"	741359482580635648	politifact15401	2
"""340 pound"" micropenis"	909440311763578880	politifact15401	2
Reports that her family is at the WH. What kind of ppl are not with their loved ones at the hospital? Very odd family dynamics.	279038942	politifact15401	2
How does she get to use a military hospital? I do wish her well.	3201025997	politifact15401	2
No disrespect to the left leaning Pope but HELL NO! People are the problem not guns. Take them away then other ways of killing people will increase. There is evil in the world & decent people need the ability to be able to protect themselves from it. #2A #NRA	79939817	politifact15512	2
You said it!	745371052230877184	politifact15512	2
Its actually a vaginal rejuvenation that trump is making her get.	933145401942859776	politifact15401	2
I'd rather wake up and see Harold Shipman going over my notes with a mischievous glint in his eye	28554386	politifact15401	2
Yes God help u	940611198139105280	politifact15401	2
I just want to know who's watching Barron, since Don certainly isn't going to suddenly start acting like a caring father in her absence.	15447907	politifact15401	2
Be Best soon.	4384739914	politifact15401	2
Democrats can say and make there statements and lies and the liberal bias mainstream media will get onboard	989787440	politifact14991	2
I bet she knows Lisa Bloom or Gloria Allred.	3669275308	politifact14749	2
NOPE ... You posted a #FakeNews website .. Try again LIGHTWEIGHT !!	819728862489755648	politifact14749	2
Like mc Cain?	26832383	politifact15401	2
Like we care about your opinion. The life choices you've made doesn't endear confidence in your ability to PROBLEM solve or think clearly beyond your boxes (Yes, boxes!)	789626171822641153	politifact15429	2
Best Warmest wishes, hope she recovers very veery soon :) <3 We are all sending warm thoughts :) <3	915483798015537152	politifact15401	2
Especially her reproductive ones. Can u spell STD?	940731926712905728	politifact15401	2
Bet she has great health insurance with no co-pays	4237663930	politifact15401	2
Melania Trump is expected to remain hospitalized for several days, and her husband remained in the White House during the procedure	18939358	politifact15401	2
omg!!!!!!!!!!!!!!!!!!!!!!!!!!!!!	379929035	politifact15401	2
You don't do that procedure for kidney stones. I looked up the procedure, is pretty serious. They just aren't telling the diagnosis at all	477474628	politifact15401	2
Praying for a speedy recovery, complete healing, and safe trip home 	2859668566	politifact15401	2
Be Best!	21585124	politifact15401	2
Poor Melania. You can only digest so much bullshit before your kidneys act up.	195698847	politifact15401	2
I second that.	235786671	politifact15401	2
I Beleave in God But have no respect for man that defends pedophilia programs, changers GODs Words. He needs to stick to scripture & strolls not politics causing harm & slavery around the world.  Remember, Heaven on Earth. WTF does he think he Is ? GOD, Sorry,  HE's NOT he a man	823082907585515522	politifact15512	2
BeBest	20665235	politifact15401	2
"Hubby to busy to go with her. Hmmm. Did you take a look at his blank schedule for today? 

Meanwhile - I wish Melania well and that she has a speedy and full recovery.

The sooner we get these criminals out of our government the better we and the world will be,"	714720425801084930	politifact15401	2
Which shows that everyone has a side. Right and left these days. We can't just come together and wish a human being a good recovery	793260312401219584	politifact15401	2
Really?	924992444533526528	politifact15401	2
That's a LONG time to be hospitalized.	1193376632	politifact15401	2
Because he could not care less.for her.	26028634	politifact15401	2
Is this why her husband spent Mother's Day with her?  Did they go to church, since they are such fine upstanding Christians?  Oh that's right- they are the opposite of Christians, and he spent the day on the golf course.  Without his kid, of course.	825844261601976320	politifact15401	2
#BlackPopenotmyPope	18175352	politifact15512	2
"#BeBest
Thoughts and prayers"	719243145263869952	politifact15401	2
"It's ""hypocrites""...there I fixed it for you."	2953244289	politifact15401	2
Is it from some disease Trump gave her after one of his escapades?	15823471	politifact15401	2
This comment would have really hit home if the white house had shown any sympathy to Senator McCain. A Republican candidate, battling cancer.	827220080547225600	politifact15401	2
Get well soon	1271169792	politifact15401	2
if he goes, at least he will finally help reduce his incredibly big carbon footprint	228529063	politifact14270	2
I think she'd rather see a dark shadowy figure in a cloak, carrying a scythe, standing at the foot of her bed rather than her husband.	28554386	politifact15401	2
Am here praying 	953394745681809409	politifact15401	2
Melania is a victim of domestic abuse, even if she denies it from her husband, she is rated/graded on Trumps actions and tweets and all that. I would buy 10 of her books after being First Lady!	832808308595515393	politifact15401	2
And where is Drumpf? Golfing??	1278234811	politifact15401	2
She most likely did not want him there.  She has been living with her parents in Maryland for the most part. Having Trump around would just make the hospital experience worse.  There is no love there.	46635383	politifact15401	2
Get well soon	1115904920	politifact15401	2
Well that hep C thing is real. Donald giving you a kidney?  Oh his messed up too.	923739475	politifact15401	2
Botox	823334719022632961	politifact15401	2
Stunning the POTUS didn't accompany Melania to the hospital. Was that his choice or hers?	24417059	politifact15401	2
I rather have my parents there, then him, wouldn't you?	1899387469	politifact15401	2
Which he has absolutely none of.	2420158367	politifact15401	2
Melanias parents.	25503160	politifact15401	2
What is all that information about her clothes and Be Best and planning a dinner doing in a story about a medical procedure?! That's...bizarre.	878391270711975936	politifact15401	2
Get Well Soon	2772078362	politifact15401	2
Pretty Sad that he couldn't take the time away from his busy golf schedule to be there, but, I'm sure he will wave to her from his golf cart	2192724056	politifact15401	2
Someone needs to be there to yell at the TV.	18155527	politifact15401	2
Best wishes and speedy recovery to the First Lady!	275557738	politifact15401	2
:O Hope she's alright.	466822109	politifact15401	2
#PrayForMelania	170460968	politifact15401	2
but it's not fun. (speaking from experience.)	905218254	politifact15401	2
I'm gonna need some sort of proof of life on this one...we all know she knows too much.	18961822	politifact15401	2
"Has anyone told the ""don""? Does Baron live near either one of them?"	770449626	politifact15401	2
Just another shining example of the Fake It to Make it group! #diditreallyhappen	755717993427046400	politifact14749	2
You need to look up on You Tube Bill Maher bit comparing the Trump WH with the MOB funny but so true.	843319285720137728	politifact15401	2
Amen to that	1897868017	politifact15401	2
I hope it's not more serious then they are admitting. It would be so horrible if she turned out to be severely sick.	89004892	politifact15401	2
Lol!	369249722	politifact15401	2
Lies are really bad for kidneys apparently.	46006485	politifact15401	2
I pray she gets well very soon.	234894998	politifact15401	2
And what is needed for the right?	813808132547715074	politifact15401	2
I bet it was one of her happiest Mother's Day.  See? Even a piece of crap can occasionally treat its spouse well by just leaving him/her alone.	2243331002	politifact15401	2
No in that case it would be a 180 pound of loveliness she would want to keep around forever.	785609157021872129	politifact15401	2
wish her a speedy recovery	238668583	politifact15401	2
Umm YEAH, FACT u uninformed lib.. WTH is wrong with u people.. you know nothing!	714937441816326146	politifact15401	2
That's a horrible headline for Trump. What kind of husband is not at hospital while his wife is in surgery? He spends enough time at the golf course away from work, surely he could have been there. Prayers for a speedy recovery for Melania.	247138147	politifact15401	2
#thoughtsandprayers hard living good life under #dicktator trump	2967290419	politifact15401	2
No sad for the gold-digging bigoted rich white birther lady.	70493517	politifact15401	2
In a statement, doctors said they were hopeful that they could remove the entire 239 pound tumor.	2627515864	politifact15401	2
Gonna guess dipshit won't be bedside with her, especially after not even mentioning her in his Mother's Day video yesterday.	34291736	politifact15401	2
Does she have coverage?	25541803	politifact15401	2
Remaining in the White House and working in the White House are two totally different things.	63454290	politifact15401	2
She has something else going on. My insurance wouldn't allow me to stay in the hospital for more than 2 to 3 days. I suspect the other days are a mental health break.	886258860633280513	politifact15401	2
Prayers for our beautiful First Lady!	785600553610981380	politifact15401	2
Anything u agree with is so true. Get a minimum wage job. Will it be ur first? Genius	743262323339468801	politifact15401	2
Trump:	966740329041772544	politifact15401	2
TY for posting this, didn't know. Well wishes & prayers to Melania. Godspeed.	760613481313890305	politifact15401	2
She probably wants to stay in the hospital to not be around dumpster!	868913240557973505	politifact15401	2
And Reid has pancreatic cancer.... in other news	728222719356047361	politifact15401	2
No, but I bet your comment would be much much worse.	32519088	politifact15401	2
Too bad poor sick children and elderly don't have the means to pay for the same predicament.	3997474157	politifact15401	2
I'm like who cares?I sure as hell don't.Send her back to Slovenia	1141834766	politifact15401	2
Woah!	175584371	politifact15401	2
Hopefully she gets the same treatment as the other vets are getting there	259850798	politifact15401	2
English immigrants? Or at least the descendants of English immigrants that came here legally- ie there were no laws against the way they came	28239343	politifact14991	2
Our prayers and thoughts go out for Melania Trump	805564345249918977	politifact15401	2
What a shitty thing to say.	2802578326	politifact15401	2
"#GetWell
#FirstLady"	213643565	politifact15401	2
And still had the time to meet 3 freed American hostages at 3 am just days ago?  She's Batwoman!  	2831985279	politifact15401	2
I hope she can recover quickly.	124868958	politifact15401	2
I reckon Trump will find this a real inconvenience. I hope he will let her recuperate before subjecting her to his carnal desires.	25724817	politifact15401	2
Your a sad person	760114803033509889	politifact15401	2
While Trump stays at WH.	2196027312	politifact15401	2
She drank too much of the Kool-Aid	123986347	politifact15401	2
She probably didn't want him there. I would imagine he makes her want to vomit.	198357693	politifact15401	2
There is no love in the Trump family except for The Special Love Between Ivanka And Daddy	823334719022632961	politifact15401	2
get a life	2334282788	politifact15401	2
I wish her well...did she know her husband's decision killed over 50 people today in Israel alone?	827951465926889472	politifact15401	2
I thought government run health care was terrible?	805520319800688640	politifact15401	2
Excellent! Hope it's leaving tomorrow. That idiot's not going anywhere. All talk.	1964909868	politifact14270	2
We send prayers of healing an quite recovery feel better many blessings	913810145192398849	politifact15401	2
IDK, actually spending time with someone he supposedly cares about before she undergoes a procedure she could die from and, even if all goes well, is going to have her cooped up in the hospital for a few days?  Kind of the bare minimum.	832317751800705024	politifact15401	2
"Really?
They definitely have a for show marriage. And it's not even a good one."	357948884	politifact15401	2
'POS' !!!!!!!!!!! SHE SHOULD BE BRAINWASHED !!!!!!!	747270848	politifact14749	2
I was thinking the same thing. I feel bad about it but it was in a private meeting.	1965182156	politifact15401	2
Get well soon!	744229423801602049	politifact15401	2
Why was her husband NOT by her side!! WTF kind of marriage is that! NO CLASS OR EMPATHY!!	55867524	politifact15401	2
Having to watch my mother go through kidney surgery, I wish the best for the First Lady, and that she recovers quickly.	774448309838581760	politifact15401	2
You'd think he'd make a visit, wouldn't you? Stay with her?	15368940	politifact15401	2
OMFG!!! 	767783347124711424	politifact15401	2
All we did was remove the Individual Mandate. That was a GOOD thing.	954888238627352576	politifact15401	2
Trump won't visit her in the hospital.  Unless the visit can be turned into a huge photo-op.	938507235826782208	politifact15401	2
The stress from her husband is the prime reason for her health issues.	3331938913	politifact15401	2
Get well soon!	19085676	politifact15401	2
Get well soon, PRAYING AND PRAYERS TO YOU, GOD BLESS MELANIA	833481408886693890	politifact15401	2
Why I hope she realizes it.	19085357	politifact15401	2
Energetically speaking, kidney issues represent holding in, well, being 'pissed off'. I cannot imagine being married to that asshole and chronic philanderer/liar and not be fucking pissed off.	1959430596	politifact15401	2
Unfortunately who can believe anything that comes out of the WH.	823577726070194177	politifact15401	2
Maybe she can get a private room for a few days and have a break from the White House?	409824643	politifact15401	2
"Yeah.....um....watch the Hannity interview earlier today....""dated"" 14-16 year olds in his 30's......and multiple witnesses who were willing to speak on the record?"	927902193759305731	politifact14749	2
Get well soon!	806329352933752832	politifact15401	2
Everyone criticizes drumpf for golfing on Mothers' Day. Why had no one considered that was his gift to her-- not being around?	179323177	politifact15401	2
I think she's faking it just to get a week away from him.	19655776	politifact15401	2
Their mouths are moving, you know what that means.	197962615	politifact14749	2
Too mean?  who cares, her Kidney is dying anyway.  #Melania #BeBest	835526448173756416	politifact15401	2
And what would you have considered appropriate?	1924753776	politifact15401	2
Staying home and sucking up all the adulation for him coming from Israel  was more important than his wife.	2504634312	politifact15401	2
Who cares?	27065736	politifact15401	2
You just had to know this came out of the demorat rot bag== when.wacko wapo is the story teller it is always horse manure	3107822628	politifact14749	2
Yes I know. He's horrible.	15368940	politifact15401	2
